root@ubuntu-s-1vcpu-1gb-tor1-01:~# tcpdump -r 0001.pcap

22:44:28.291159 IP ubuntu-s-1vcpu-1gb-tor1-01.ssh > 108.108.202.35.bc.googleusercontent.com.60882: Flags [P.], seq 1378:1446, ack 1121, win 502, options [nop,nop,TS val 2514358375 ecr 4205001501], length 68
22:44:28.314473 IP 108.108.202.35.bc.googleusercontent.com.60882 > ubuntu-s-1vcpu-1gb-tor1-01.ssh: Flags [P.], seq 1121:1205, ack 1446, win 501, options [nop,nop,TS val 4205001524 ecr 2514358375], length 84
22:44:28.314509 IP ubuntu-s-1vcpu-1gb-tor1-01.ssh > 108.108.202.35.bc.googleusercontent.com.60882: Flags [.], ack 1205, win 502, options [nop,nop,TS val 2514358398 ecr 4205001524], length 0
22:44:28.320711 IP ubuntu-s-1vcpu-1gb-tor1-01.ssh > 108.108.202.35.bc.googleusercontent.com.60882: Flags [P.], seq 1446:1514, ack 1205, win 502, options [nop,nop,TS val 2514358404 ecr 4205001524], length 68
22:44:28.346811 IP 108.108.202.35.bc.googleusercontent.com.60882 > ubuntu-s-1vcpu-1gb-tor1-01.ssh: Flags [P.], seq 1205:1305, ack 1514, win 501, options [nop,nop,TS val 4205001556 ecr 2514358404], length 100
22:44:28.390109 IP ubuntu-s-1vcpu-1gb-tor1-01.ssh > 108.108.202.35.bc.googleusercontent.com.60882: Flags [.], ack 1305, win 502, options [nop,nop,TS val 2514358474 ecr 4205001556], length 0
22:44:28.974989 IP 20.127.30.64.1920 > ubuntu-s-1vcpu-1gb-tor1-01.5038: Flags [S], seq 1424019193, win 1024, length 0
22:44:28.975038 IP ubuntu-s-1vcpu-1gb-tor1-01.5038 > 20.127.30.64.1920: Flags [R.], seq 0, ack 1424019194, win 0, length 0

