root@ubuntu-s-1vcpu-1gb-tor1-01:~# tcpdump -n -i eth0

22:46:16.853477 IP 143.198.33.71.22 > 37.19.211.108.64786: Flags [P.], seq 1707428:1707592, ack 1009, win 63920, length 164
22:46:16.853529 IP 143.198.33.71.22 > 37.19.211.108.64786: Flags [P.], seq 1707592:1707756, ack 1009, win 63920, length 164
22:46:16.853611 IP 143.198.33.71.22 > 37.19.211.108.64786: Flags [P.], seq 1707756:1707920, ack 1009, win 63920, length 164
22:46:16.853682 IP 143.198.33.71.22 > 37.19.211.108.64786: Flags [P.], seq 1707920:1708084, ack 1009, win 63920, length 164
22:46:16.853747 IP 143.198.33.71.22 > 37.19.211.108.64786: Flags [P.], seq 1708084:1708248, ack 1009, win 63920, length 164
22:46:16.854239 IP 37.19.211.108.64786 > 143.198.33.71.22: Flags [.], ack 1691588, win 65280, length 0
22:46:16.854258 IP 143.198.33.71.22 > 37.19.211.108.64786: Flags [P.], seq 1708248:1708412, ack 1009, win 63920, length 164
22:46:16.854340 IP 37.19.211.108.64786 > 143.198.33.71.22: Flags [.], ack 1691916, win 64952, length 0
22:46:16.854340 IP 37.19.211.108.64786 > 143.198.33.71.22: Flags [.], ack 1692244, win 64624, length 0
^C
12062 packets captured
12076 packets received by filter
10 packets dropped by kernel
